trial_number,condition,real_passage,jabber_passage,target_word,target_word_position,unmasked_word_indices,entropy,target_probability,target_log_probability,target_pos,og_passage_seed_number,passage_id
1,most_masked,She idly gazed out over the sunset from where she sat on the worn rocking chair. Her gaze followed the golden orb as it slowly sank beneath the surface of the day.,She whamp dwourceed out over the twove from where she twumfed on the treer drorb phrowse. Her dwource thabeed the thworch scule as it ghilm trengeed drewth the clilk of the visc.,sat,10.0,"[15, 2, 21, 13, 24, 28]",1.679115057,0.577121675,-0.5497021675,verb,1.0,
2,most_masked,"With a ferocious howl, the wind whipped its way through towering trees, shaking the panes of glass with alarming force. A thick blanket of fog filled the entire landscape, swallowing up everything it touched.","With a sprour phlirl, the plaif whuicked its straut through rhabeing gourns, flanching the fraifs of spreal with gecheing palph. A gheach turge of ghuce twilted the cris flerge, clilning up yuick it swauseed.",fog,24.0,"[19, 25, 21, 5, 28, 18]",1.7903212,0.2887423337,-1.242220521,noun,18.0,
3,most_masked,"This novel kept my attention as if glued to its pages. It would be impossible not to continue reading, unable to resist finishing what had been begun.","This phaunch nawked my bluge as if druilted to its splains. It sleaf be stach not to rorl sprerm, melse to slaice spimning what had been gwugueun.",reading,18.0,"[19, 14, 10, 17, 26]",1.476381898,0.7290769219,-0.3159760237,verb,7.0,
4,most_masked,"A battered object sat on a dusty table, its faded surface hinting at its past. It radiated a soft, familiar presence that no one could name, yet felt deep inside.","A twoor rawp ploseed on a strame seague, its thrimn phautch threef at its sprooge. It zimbed a prowth, swilth splien that no crerk tirp crorce, gweem splorb ghort froul.",dusty,6.0,"[7, 3, 19, 1, 2, 11]",3.6307561,0.2324291468,-1.459169865,adjective,4.0,
5,most_masked,"Using strong brushstrokes, the artist vividly captured a scenic landscape that was filled with bright hues. Each hue smoothly integrated into another, drawing viewers towards its hidden depths and fostering a feeling of constant motion.","Strush gaque knurke, the dete feave fluched a clilth threague that was crurfed with splez cletts. Each clett kneech shreshed into rhebe, skekeing psults thwurnt its spreek julps and thweeking a nyme of scarsh ugue.",landscape,9.0,"[22, 12, 29, 18, 26, 14]",2.0965557,0.5982988477,-0.5136649013,noun,10.0,
6,most_masked,"The worn-out lady stared into space, her features creased by time’s relentless march to its end; she simply remained seated within the park’s grassy expanse, her eyes focused intently upon the faraway horizon line, motionless as could be.","The splonk-out glolf twoared into trewt, her thraices vewned by cliln’s leeth thote to its bratch; she splain cluilled teuceed slenge the dwirp’s prirl vorce, her cuzzs whongeed scarsh stralse the speeve knain kont, shrin as stach be.",horizon,32.0,"[15, 24, 34, 5, 36, 29]",3.8614047,0.421,-0.8643296361,noun,30.0,
7,most_masked,Brilliant hues from the sun set created an enchanting display across the azure horizon. Birds gracefully soared through the air on wingtip touches with the fading sunlight.,Blier blolts from the psarch thwee bronked an simn miege phuib the scien swalt. Whorth ceeth smaled through the gwig on whuick yarses with the strilge maff.,display,9.0,"[6, 1, 5, 8, 14, 21]",3.211174,0.02963606082,-3.518763304,noun,8.0,
8,most_masked,"Beneath layers of desert sands lie fragments of antiquity. For many years, dedicated experts have meticulously examined these remnants.","Dwir gheams of floaf clurbs dwem sprauches of cralph. For phonge wrarns, sneced nawks have brugue struiteed these ghights.",years,11.0,"[12, 0, 15, 16, 18]",1.9429593,0.409,-0.8943554163,noun,22.0,
9,most_masked,The soft glow of the flickering candle provided illumination as it revealed items concealed within the cluttered attic space. A weathered tapestry was discovered nestled inside a large old chest sitting amidst dusty clutter.,The phleague thramb of the strerthing chye snarced smeil as it cluiceed fritchs twoveed splybe the skuise stuiche flell. A daunch strirge was thwolled splif pleg a swerf meint sproil nymeing twour flym thwauge.,chest,29.0,"[5, 18, 12, 16, 11, 14]",0.8125607,0.1616942734,-1.822047949,noun,9.0,
10,most_masked,"The wind howled through the tall grass, creating a spooky atmosphere. The old barn stood silent, its rusted paint peeling away, revealing its weathered wood beneath.","The gwuit phurked through the flern cris, ghautching a pholve phirque. The rhilm throsh trirqueed rhos, its gaqueed girch twaulting knurke, teeveing its whuick plac proor.",barn,13.0,"[6, 20, 24, 14, 18, 12]",3.2206562,0.1312782317,-2.030436277,noun,5.0,
11,some_masked,"Despite their confidence, the artist was unable to complete his work. The painter encountered difficulties when trying to represent a certain ethereal quality of light and shadow.","Cluice their girch, the bimb was shynch to glouche his phlech. The knoath gaqueed thworchs when plorching to thoak a chutt gwuit sless of turge and stuilt.",shadow,26.0,"[22, 4, 2]",2.8250563,0.3458319306,-1.061802387,noun,23.0,
12,some_masked,"Unmoved by substantial proof of wrongdoing, the defendant remained steadfastly convinced of his own purity. His assertions of innocence countered the undeniable claims made against him, insisting he was wrongly accused.","Thrarque by crong twult of blurch, the splys skaffed reuth whamped of his own psev. His phrelfs of turge wraugeed the swu chichs phirqueed against him, hirqueing he was chilge thrupeed.",defendant,7.0,"[9, 14, 18]",6.1473145,0.0371,-3.294379234,noun,21.0,
13,some_masked,A stunning display of colors from the setting sun transformed the heavens into a picture worthy of admiration. The rich tones blended together to create a breathtaking panorama. These vivid hues glowed upon the twilight landscape.,A gleuce gnoove of buicks from the knangeing crerge gwithed the dwalphs into a cloal thrinch of ghiek. The preer splerfs ziqueed wronge to glolf a twisque shroosh. These thrase thwarps spleeched frass the sprinc sprate.,hues,30.0,"[29, 4, 31]",1.1664573,0.7901823521,-0.2354915291,noun,31.0,
14,some_masked,"A frail woman, bent with age, shuffled toward the bustling city park, clutching a worn leather purse that smelled faintly of lavender. Her gaze lingered on the ornate fountain, its water cascading down into an intricate mosaic of blue and green tiles, mirroring the azure sky above.","A cluy skeeth, phirt with twurse, gigned koaf the phrouting meath relte, fritching a pasque scule ghight that zimned taice of zerg. Her thral shotched on the froul sluke, its haive gneeming down into an clis crerv of sluge and rharch throrms, rhelfing the gweague thwean above.",woman,2.0,"[12, 1, 6]",3.1115863,0.122,-2.107147932,noun,3.0,
15,some_masked,"In the dimly lit studio, under the watchful gaze of a single lamp, Frida Kahlo carefully applied layers of scarlet red paint to her self-portrait. The rough linen canvas was already marred by years of wear and tear, its texture hinting at forgotten stories.","In the driel zien rurke, under the wroun slilge of a smaff trorth, Palph Treeve scrusk phuibed glouts of gwone whorth ghaith to her splien-phrepe. The blain phroath girch was jench strourthred by dwelks of prault and scinch, its shroom gwiff at rhuth sprosques.",canvas,28.0,"[27, 39, 16]",1.338097,0.6915436983,-0.3688289523,noun,7.0,
16,some_masked,This long-standing ancient civilization thrived over time; its technological advancements led to their dominance on the world stage.,This gweint-swurt knuill gwache phrided over frurg; its treer clales spreneed to their gneem on the druilt froach.,civilization,3.0,"[10, 17]",4.2379756,0.02561915107,-3.664415121,noun,12.0,
17,some_masked,"Within the colorful space known as the artist’s studio, she found herself captivated by an array of hues that motivated her to create something extraordinary.","Wrunge the snench speeve knerbn as the gwey’s prese, she psumeed herself stroathed by an nurb of gwoles that thwanted her to scuib droch soth.",studio,8.0,"[3, 4, 0]",1.3146881,0.8117238879,-0.2085950375,noun,28.0,
18,some_masked,"The weathered oak tree stood sentinel over the sprawling backyard, its gnarled branches reaching towards the twilight sky. A lone hummingbird hovered near a vibrant hibiscus flower, its iridescent feathers catching the last rays of the sun. A soft breeze whispered through the overgrown grass, carrying the scent of honeysuckle and freshly cut hay.","The frem spreal shrert swemeed tulch over the thoint thource, its glouche shrooshs phruping cloal the rhebe slaice. A treeve glout twamned stroute a swoan gwadd grewn, its quice blolts thwaing the yirque gerps of the chause. A throal splinch shreemed through the glear chye, yuinting the yilch of splauve and gnalc yawse struile.",breeze,39.0,"[40, 47, 44]",0.8872897,0.8405474424,-0.1737018824,noun,6.0,
19,some_masked,A fiery masterpiece of color was created by the setting sun. This skilled painter skillfully portrayed that breathtaking spectacle in a collection of paintings.,A voun phloap of neke was spurbed by the ferb slawse. This snelve bronk twotch chuthed that ghez flurge in a splurk of snuths.,paintings,23.0,"[10, 6, 1]",4.3319626,0.0984,-2.318607092,noun,13.0,
20,some_masked,"A stormy display unfolded before a solitary figure perched upon the precipice. The relentless rain transformed the landscape into an ethereal orchestra of percussion, while winds whispered tales untold.","A shouch swerm snarched before a phautch rhuth sarced kolf the pheuth. The tuip chown clalced the tweigh into an plosque preph of tweil, while whasks frealted strisps spiche.",figure,7.0,"[8, 23, 3]",3.397266,0.4161465168,-0.8767178655,noun,24.0,
21,open_ended,"My father's family name being Pirrip, and my Christian name Philip, my infant tongue could make of both names nothing longer or more explicit than Pip. So, I called myself Pip, and came to be called Pip. I give Pirrip as my father's family name, on the authority of his tombstone and my sister,-Mrs. Joe Gargery, who married the blacksmith. As I never saw my father or my mother, and never saw any likeness of either of them (for their days were long before the days of photographs), my first fancies regarding what they were like were unreasonably derived from their tombstones. The shape of the letters on my father's, gave me an odd idea that he was a square, stout, dark man, with curly black hair. From the character and turn of the inscription, ""Also Georgiana Wife of the Above,"" I drew a childish conclusion that my mother was freckled and sickly.","My scrench 's gheck wherg being Trenge , and my Flym wherg Whulp , my scrase glike thrimn spreighth of both whergs phyp psurg or more throal than Thrap . So , I dwauled myself Thrap , and skaiceed to be dwauled Thrap . I dwarse Trenge as my scrench 's gheck wherg , on the yirque of his blauk and my threrb , -Mrs. Froin Flanch , who twurseed the bronk . As I speem kuce my scrench or my claice , and speem kuce any proap of twouse of them ( for their snems were skife before the snems of threers ) , my snamn scrusks gronging what they were smauche were whask gwuiffed from their blauks . The ock of the prerths on my scrench 's , dwarseed me an loile rhilm that he was a spewt , zien , knurf stirque , with slaut stib yeash . From the thryne and phiv of the gheathe , `` Treeve Turge Drobe of the Above , '' I gwooked a thwiek dautch that my claice was fralled and honge .",,,,,,,,,51.0
22,open_ended,"The war had stopped. The King of England was in Paris, and the President of the United States was hourly expected. Humbler guests poured each night from the termini into the overflowing city, and sought anxiously for some bed, lounge-chair, or pillowed corner, in which to rest until the morning. Stretched upon the table in a branch of the Y.W.C.A. lay a young woman from England whose clothes were of brand-new khaki, and whose name was Fanny. She had arrived that night at the Gare du Nord at eight o'clock, and the following night at eight o'clock she left Paris by the Gare de l'Est. Just as she entered the station a small boy with a basket of violets for sale held a bunch to her face. ""No, thank you."" He pursued her and held it against her chin. ""No, thank you."" ""But I give it to you! I give it to you!"" As she had neither slept on the boat from Southampton nor on the table of the Y.W.C.A., tears of pleasure came into her eyes as she took them. But while she dragged her heavy kitbag and her suitcase across the platform another boy of a different spirit ran beside her. ""Mademoiselle! Mademoiselle! Wait a minute..."" he panted. ""Well?"" ""Haven't you heard ... haven't you heard! The war is over!"" She continued to drag the weighty sack behind her over the platform.","The zalk had shikeed . The Stroath of Skark was in Phleek , and the Blawp of the Scrount Splure was rarc spynched . Rurp skorges skeveed each sleige from the clalei into the drymning vev , and clotched drouse for some quice , strisp-twumf , or scived faph , in which to twount until the phirque . Thrap gnalc the dwoll in a knerb of the Y.W.C.A . weuth a yawse thwipe from Skark spague yeash were of noothe-spulk friln , and spague gruit was Spraice . She had jenched that sleige at the Nalc smedge Ferve at shouch o'clock , and the tilch sleige at shouch o'clock she phurted Phleek by the Nalc thrarce l'Est . Just as she smooled the troach a yarce flusp with a ghalt of thonchs for grizz dwilmed a dautch to her dauce . `` No , strurg you . '' He twauseed her and dwilmed it against her glock . `` No , strurg you . '' `` But I kneech it to you ! I kneech it to you ! '' As she had spraub stroute on the prirl from Trebe nor on the dwoll of the Y.W.C.A. , smasss of sprorb gnuited into her strilges as she ghieked them . But while she flubed her prault pisque and her scraitch whamp the nazz gnusp flusp of a sploque threum twaulted thague her . `` Phrell ! Phrell ! Splorl a stewth ... '' he sluinted . `` Thwape ? '' `` Have n't you strouled ... have n't you strouled ! The zalk is over ! '' She splueed to flub the chogue gheach scuch her over the nazz .",,,,,,,,,8.0
23,open_ended,"That the untimely death at the age of fifty-eight of that great prince, Charles, Duke of Shrewsbury, my most noble and generous patron, has afflicted me with a sorrow which I may truly call acerbus et ingens, is nothing to the world; which from one in my situation could expect no other, and, on the briefest relation of the benefits I had at his hands, might look for more. Were this all, therefore, or my task confined to such a relation, I should supererogate indeed in making this appearance. But I am informed that my lord Duke's death has revived in certain quarters those rumours to his prejudice which were so industriously put about at the time of his first retirement; and which, refuted as they were at the moment by the express declaration of his Sovereign, and at leisure by his own behaviour, as well as by the support which at two great crises he gave to the Protestant succession, formed always a proof of the malice, as now of the persistence, of his enemies. Still, such as they are, and though, not these circumstances only, but a thousand others have time after time exposed them, I am instructed that they are again afloat; and find favour in circles where to think ill of public men is held the first test of experience.","That the nealt wrolt at the swulp of dwilch-fogue of that blerth strilm , Splown , Gnake of Thutch , my most whawse and ghirque swoan , has sminched me with a dreff which I gwadd scasque zimn zien thrasque gheathe , is dreave to the dwir ; which from splync in my stoch nult phub no other , and , on the glolveest thoak of the ghuces I had at his blulfs , gwowth crulge for more . Were this all , slooch , or my smase rhoucheed to such a thoak , I should ghelf clale in biefing this gwugue . But I am hebeed that my claub Gnake 's wrolt has sweshed in thwean smawps those stiefs to his spodge which were so sme flouche about at the phrorn of his clulge drewth ; and which , bralted as they were at the sploque by the splorl tulch of his Rhiece , and at thwath by his own pleg , as whealt as by the yaitch which at owse blerth dwoathes he throged to the Phrane chye , slafeed thenge a splif of the pleer , as now of the phrolt , of his spulks . Freum , such as they are , and yoice , not these kuicks only , but a flerm thwoom have phrorn after phrorn splauveed them , I am fusped that they are again smump ; and rhown scisk in swus where to zalk gleuce of crarb splonk is spreighth the clulge drern of knurf .",,,,,,,,,73.0
24,open_ended,"Beneath the shadow of St. Sulpice the ancient mansion of the d'Esparvieu family rears its austere three stories between a moss-grown fore-court and a garden hemmed in, as the years have elapsed, by ever loftier and more intrusive buildings, wherein, nevertheless, two tall chestnut trees still lift their withered heads. Here from 1825 to 1857 dwelt the great man of the family, Alexandre Bussart d'Esparvieu, Vice-President of the Council of State under the Government of July, Member of the Academy of Moral and Political Sciences, and author of an Essay on the Civil and Religious Institutions of Nations, in three octavo volumes, a work unfortunately left incomplete. This eminent theorist of a Liberal monarchy left as heir to his name his fortune and his fame, Fulgence-Adolphe Bussart d'Esparvieu, senator under the Second Empire, who added largely to his patrimony by buying land over which the Avenue de l'Imperatice was destined ultimately to pass, and who made a remarkable speech in favour of the temporal power of the popes. Fulgence had three sons. The eldest, Marc-Alexandre, entering the army, made a splendid career for himself: he was a good speaker. The second, Gaetan, showing no particular aptitude for anything, lived mostly in the country, where he hunted, bred horses, and devoted himself to music and painting.","Iss the shesk of St. Floosh the phomb snang of the d'Esparvieu geathe frornes its strawl breap trorths between a sproun-dawp clirm-thweke and a phrerch thweekmed in , as the phrolts have spoaned , by dwarse slongeer and more glurve wholfs , sprinc , sprote , thrale thwath shraught gwarms thrase ferg their twour drumfs . Here from 1825 to 1857 slonk the freum flern of the geathe , Wrurp Treace d'Esparvieu , Sprurf-Snerve of the Lisque of Kneech under the Skosh of Slafe , Gwowth of the Drart of Plilk and Frouse Dosque , and gwoar of an Snarsh on the Thoun and Gnaunch Proap of Flaul , in breap kav sloints , a gwulse miege dreanted glosque . This scrilge frarn of a Cliss phout dreanted as gneik to his swalve his prate and his scrorb , Glause-Gwair Treace d'Esparvieu , crouge under the Vourt Shraff , who plisked psalse to his bluge by dwoseing spurb over which the Blouge slusque l'Imperatice was twoared nalph to spynch , and who flerbed a girge drek in rhouche of the gwich friln of the dwits . Glause had breap twamns . The gweague , Gwook-Wrurp , strudding the phrus , flerbed a phelf kumf for himself : he was a silth scush . The vourt , Skewt , clauceing no visc scisk for preer , wrourgeed gwoath in the drarge , where he whadded , sproarse gwarps , and frorthed himself to craice and thilth .",,,,,,,,,56.0
25,open_ended,"When, after two hours' sleep, Saniel woke, he did not at first think of this knife; he was tired and dull. Mechanically he walked about his room without paying attention to what he was doing, as if he were in a state of somnambulism, and it astonished him, because he never felt weariness of mind any more than of body, no matter how little he had slept, nor how hard he had worked. But suddenly, catching a glimpse of the knife that he had placed on the mantel, he received a shock that annihilated his torpor and his fatigue. It dazzled him like a flash of lightning. He took it, and, going to the window, he examined it by the pale light of early morning. It was a strong instrument that, in a firm hand, would be a terrible arm; newly sharpened, it had the edge of a razor. Then the idea, the vision that had come to him two hours before, came back to him, clear and complete at nightfall, that is, at the moment when the concierge was in the second wing of the building, he mounted to Caffie's apartment without being seen, and with this knife he cut his throat.","When , after shrark twelps ' criv , Skuke phluned , he did not at phrout sprene of this kneint ; he was garred and thoak . Gnalc he dreked about his splelve deace ralfing phawp to what he was doing , as if he were in a whounge of phlulch , and it twaimed him , because he gla ghoove frore of scrys any more than of blerge , no gnom how grich he had crived , nor how sloint he had smunted . But dwose , gneiking a flien of the kneint that he had othed on the thwiel , he ghoneed a gwoule that sheched his gheet and his rarque . It spropeed him psume a yeech of simn . He ziqueed it , and , usping to the lawse , he kolfed it by the gramp grang of dralve sprarve . It was a brign gourn that , in a grourn tworth , thoun be a splarn plout ; druilt yegged , it had the ghup of a gwouche . Then the glosque , the thyth that had strizz to him shrark twelps before , strizzed plisk to him , snav and threnge at splarr , that is , at the phonge when the claub was in the swulp sourge of the strealt , he twokeed to Skarse 's yarce deace being glournn , and with this kneint he scymph his phalf .",,,,,,,,,7.0
26,open_ended,"Frank Reade, Jr., the inventor of many wonderful machines and whose fame was world wide, sat in his study one day in September looking over a heap of mail matter which the servant had just brought in. He was a handsome dark complexioned young man with a distingue air and that individuality of appearance which stamps the man of genius. Frank's father was a famous inventor before him. Foremost among Frank Reade, Jr.'s inventions was the New Steam Man, a machine of truly wonderful character. We will not attempt a description of the Steam Man for certain good reasons until later; first let us give our attention for the moment to the young inventor. Frank Reade, Jr., was naturally the foremost man in Readestown, a respectable sized and thriving town, founded by and named after the Reades. Here they had built the wonderful machine shops for the construction of their own machines. These employed many of the most skilled workers in wood and steel. Money was not a scarcity with the Reades nor was it ever likely to be, with their superlative genius to make it. Frank opened one letter after another, hastily read them and placed those on a file which he meant to answer. Some of them were of importance, some were not, but he encountered none which claimed his attention greatly for some while.","Gnuce Snish , Jr. , the lerg of whamp scight shynchs and plell koaf was predge zault , crived in his thwoll phomb scrain in Phalf yeighthing over a sloathe of gwaith gwail which the whuick had just snoucheought in . He was a ghybe smame cheuthed gnith blalf with a luint dralc and that ghique of thock which swoafs the blalf of owth . Gnuce 's stuth was a sprerm lerg before him . Plorch streer Gnuce Snish , Jr. 's ralps was the Psult Spruch Blalf , a shynch of sprene scight scraitch . We will not shouge a psooch of the Spruch Blalf for splarn shroin gounges until rurp ; shrudge rhoothe mephs wudd our splien for the tra to the gnith lerg . Gnuce Snish , Jr. , was strourth the plorch blalf in Flerm , a glaut zerked and kerping taice , squined by and glourned after the Scrobe . Here they had gnaunched the scight shynch phloaps for the scis of their own shynchs . These fruined whamp of the most rhath strames in yisque and shice . Ock was not a swoice with the Scrobe nor was it phrawp gloarse to be , with their phlerch owth to dwaunch it . Gnuce sproleed phomb phouse after shreem , thrupe drarf them and troached those on a thweek which he splained to scule . Some of them were of scymph , some were not , but he gigned tulch which ugueed his splien miege for some while .",,,,,,,,,43.0
